{
 "exam": "SSC CGL",
 "year": 2025,
 "tier": "Tier I",
 "date": "2025-09-12",
 "shift": "Shift-3",
 "source": "Oliveboard CBE 'challenge module' response-sheet export of the actual SSC CGL 2025 Tier I screen - header 'Exam Level: SSC CGL Tier 1 | Test Date: 12 Sep 2025 | Test Time and Shift: 04:00 PM (Shift-3)' with per-question status legend 'Correct Option selected / Wrong Option selected / Correct Option / Not Answered' and candidate undertaking: https://download.oliveboard.in/pdf/ssc-cgl-12th-sep-shift-3.pdf (accessed 2026-08-24; linked from Oliveboard's SSC CGL Tier 1 PYP page https://www.oliveboard.in/blog/ssc-cgl-tier-1-pyps/). IMPORTANT export caveat (verbatim from the PDF): 'in the challenge module the sequence of the questions and the options may be different from how it appeared during the examination ... the answer key selected by the candidates during the examination will exactly be reflected in the challenge module.' - i.e. question/option ORDER in this export may not match the live CBE screen order, though the candidate's selections are preserved.",
 "corroborating_sources": [
  {
   "name": "Oliveboard CGL 2025 response sheets for the same date, Shifts 1-2 (same CDN, same export class; Shift-1 and Shift-2 files are in this repository)",
   "url": "https://download.oliveboard.in/pdf/ssc-cgl-12th-sep-shift-1.pdf",
   "note": "Same export class exists for Shift-1 (09:00 AM) and Shift-2 (12:30 PM) of the same date (12 Sep 2025). Corroborates that three shifts were held on 12-Sep-2025 at 09:00 / 12:30 / 16:00. NOT used as a question-level source for this file."
  },
  {
   "name": "Adda247 - SSC CGL Previous Year Question Paper page",
   "url": "https://www.adda247.com/jobs/ssc-cgl-previous-year-question-paper/",
   "note": "Lists CGL 2025 'Similar Paper' (RECONSTRUCTED) PDFs for 12 Sep 2025 - corroborates that CGL 2025 Tier I was conducted on 12 Sep 2025. NOT used as a question-level source for this file."
  }
 ],
 "source_type": "MEMORY-BASED",
 "verification_status": "verified",
 "notes": "PARTIAL-CONTENT FILE - READ FIRST: this is a genuine SSC CBE response-sheet export ('challenge module' save) for the exact date+shift (header Test Date 12 Sep 2025, 04:00 PM Shift-3), but the source PDF is longer than the 30-page parse limit available in this environment: only PART-A (General Intelligence and Reasoning, Q1-25), PART-B (General Awareness, Q26-50) and the first three PART-C (Quantitative Aptitude) questions (Q51-53, Q53 options mostly missing) are in the parsed layer; Q54-75 (Quant) and Q76-100 (English) are ABSENT from the parsed layer and are marked [NOT RECOVERABLE] - they have NOT been invented, completed or paraphrased. Within the recovered range: Q11 has an empty question body in the parsed layer; Q10, Q46 have fewer than 4 options; Q25's English stem is missing (recovered garbled Hindi stem noted verbatim in the question). SECTIONS/NUMBERING: this export numbers questions globally 1-100 in the order PART-A GI&R (1-25), PART-B General Awareness (26-50), PART-C Quantitative Aptitude (51-75), PART-D English (76-100) - the section labels and Q.No are from the export itself. ORDER CAVEAT (quoted above): the challenge-module export may reorder questions and options relative to the live exam screen; the candidate's answer selections are preserved. This file therefore does NOT guarantee the live screen's question/option order. BILINGUAL SOURCE: every question in the source is bilingual (English + Hindi); only the English layer was transcribed here (the Hindi layers are largely garbled in the parsed text and are noted verbatim only where the English layer was missing - Q25). SSC QUESTION IDs: not present in this export class; question_id is null throughout. CANDIDATE RESPONSES: only the 'Not Answered' status was recoverable as text (Q11, Q27, Q28, Q29, Q35, Q51); answered-question status markers ('Correct Option selected'/'Wrong Option selected') are rendered as graphics and were NOT recovered, so no candidate choice is recorded. ANSWERS: the export's legend implies per-question correct/incorrect marking, but the actual correct-option identity is not present in the recovered text layer for any question, and the official CGL 2025 tentative answer key (SSC, October 2025) is downloadable only by logged-in candidates; no machine-accessible official key was found in this environment - so every correct_answer here is null and answer_source null. Do not infer answers from the export legend or from AI reasoning.",
 "questions": [
  {
   "question_number": 1,
   "subject": "General Intelligence and Reasoning",
   "question_id": null,
   "question": "Select the letter-cluster from among the given options that can replace the question mark (?) in the following series. A E I,E I M,I M Q,M Q U, ?",
   "options": {
    "A": "QUY",
    "B": "QKS",
    "C": "LMX",
    "D": "KJS"
   },
   "correct_answer": null,
   "answer_source": null,
   "answer_note": "No candidate-status line recovered from parsed text layer (answered-status markers are rendered as graphics and were not in the text layer; the export's legend is 'Correct Option selected / Wrong Option selected / Correct Option / Not Answered'). Candidate answer not recovered."
  },
  {
   "question_number": 2,
   "subject": "General Intelligence and Reasoning",
   "question_id": null,
   "question": "Select the letter-cluster from among the given options that can replace the question mark(?)in the following series.\nACE EIM IOU MUC?",
   "options": {
    "A": "QSA",
    "B": "UHG",
    "C": "QAK",
    "D": "CGD"
   },
   "correct_answer": null,
   "answer_source": null,
   "answer_note": "No candidate-status line recovered from parsed text layer (answered-status markers are rendered as graphics and were not in the text layer; the export's legend is 'Correct Option selected / Wrong Option selected / Correct Option / Not Answered'). Candidate answer not recovered."
  },
  {
   "question_number": 3,
   "subject": "General Intelligence and Reasoning",
   "question_id": null,
   "question": "What comes next:12,30,56,90,132,?",
   "options": {
    "A": "182",
    "B": "250",
    "C": "190",
    "D": "293"
   },
   "correct_answer": null,
   "answer_source": null,
   "answer_note": "No candidate-status line recovered from parsed text layer (answered-status markers are rendered as graphics and were not in the text layer; the export's legend is 'Correct Option selected / Wrong Option selected / Correct Option / Not Answered'). Candidate answer not recovered."
  },
  {
   "question_number": 4,
   "subject": "General Intelligence and Reasoning",
   "question_id": null,
   "question": "What will be come at the place of question mark? 1, 2, 5, 26, 677, ?",
   "options": {
    "A": "458330",
    "B": "456976",
    "C": "453625",
    "D": "458329"
   },
   "correct_answer": null,
   "answer_source": null,
   "answer_note": "No candidate-status line recovered from parsed text layer (answered-status markers are rendered as graphics and were not in the text layer; the export's legend is 'Correct Option selected / Wrong Option selected / Correct Option / Not Answered'). Candidate answer not recovered."
  },
  {
   "question_number": 5,
   "subject": "General Intelligence and Reasoning",
   "question_id": null,
   "question": "Find the number that fits:2, 5, 10, 17, ?",
   "options": {
    "A": "26",
    "B": "24",
    "C": "21",
    "D": "20"
   },
   "correct_answer": null,
   "answer_source": null,
   "answer_note": "No candidate-status line recovered from parsed text layer (answered-status markers are rendered as graphics and were not in the text layer; the export's legend is 'Correct Option selected / Wrong Option selected / Correct Option / Not Answered'). Candidate answer not recovered."
  },
  {
   "question_number": 6,
   "subject": "General Intelligence and Reasoning",
   "question_id": null,
   "question": "Instruction:Identify the assumptions that must hold for the statement to be valid, then choose the correct option.\nStatement:While the world is moving towards automation,it is essential to ensure that ethical frameworks evolve alongside technological advancements to prevent misuse.\nAssumptions:\nI.Automation can lead to ethical dilemmas.\nII.Ethical frameworks must be updated to keep pace with technological advancements.\nIII.Automation will eventually replace human labor in all sectors.",
   "options": {
    "A": "Only I and II are implicit",
    "B": "Only I and III are implicit",
    "C": "All are implicit",
    "D": "Only I is implicit"
   },
   "correct_answer": null,
   "answer_source": null,
   "answer_note": "No candidate-status line recovered from parsed text layer (answered-status markers are rendered as graphics and were not in the text layer; the export's legend is 'Correct Option selected / Wrong Option selected / Correct Option / Not Answered'). Candidate answer not recovered."
  },
  {
   "question_number": 7,
   "subject": "General Intelligence and Reasoning",
   "question_id": null,
   "question": "The position of how many letters will remain unchanged if each of the letters in the word DEVELOP is arranged in alphabetical order?",
   "options": {
    "A": "Two",
    "B": "Four",
    "C": "Three",
    "D": "Five"
   },
   "correct_answer": null,
   "answer_source": null,
   "answer_note": "No candidate-status line recovered from parsed text layer (answered-status markers are rendered as graphics and were not in the text layer; the export's legend is 'Correct Option selected / Wrong Option selected / Correct Option / Not Answered'). Candidate answer not recovered."
  },
  {
   "question_number": 8,
   "subject": "General Intelligence and Reasoning",
   "question_id": null,
   "question": "Identify the similar address:No.45,First Avenue,Raja Annamalaipuram,Chennai,Tamil Nadu-600028",
   "options": {
    "A": "No.45,1st Avenue,R.A.Puram,Chennai,TN600028",
    "B": "No.45,First Avenue,Raja Annamalaipuram,Chennai,Tamil Nadu-600028",